{
  "schema_version": "1.0.0",
  "site_id": "SITE001",
  "revision": 2,
  "name": "Demo construction site",
  "width_m": 100,
  "height_m": 100,
  "zones": [
    {
      "zone_id": "ZONE001",
      "name": "Restricted area",
      "kind": "restricted",
      "polygon": [
        {
          "x_m": 70,
          "y_m": 70
        },
        {
          "x_m": 90,
          "y_m": 70
        },
        {
          "x_m": 90,
          "y_m": 90
        },
        {
          "x_m": 70,
          "y_m": 90
        }
      ],
      "terrain": "firm"
    }
  ],
  "static_objects": [
    {
      "object_id": "OBS001",
      "kind": "obstacle",
      "position": {
        "x_m": 50,
        "y_m": 50
      },
      "radius_m": 2
    }
  ],
  "destinations": [
    {
      "destination_id": "DEST_A",
      "label": "Material pickup",
      "position": {
        "x_m": 20,
        "y_m": 20
      },
      "radius_m": 3
    },
    {
      "destination_id": "DEST_B",
      "label": "Deposit",
      "position": {
        "x_m": 38,
        "y_m": 20
      },
      "radius_m": 3
    }
  ],
  "coordinate_system": "local_meters_east_north"
}
